[
  {
    "claim_id": "CLM_RETRIEVAL_PRACTICE",
    "statement": "Actief ophalen uit het geheugen (retrieval practice) versterkt langdurige retentie en ondersteunt transfer, zeker wanneer de leerling zelf produceert en daarna gerichte feedback krijgt.",
    "supports": {
      "rubric_dimensions": [
        "P_Procesfase",
        "L_LeercontinuiteitTransfer",
        "C_CoRegulatie"
      ],
      "design_patterns": [
        "retrieval_practice",
        "feedback_loop"
      ]
    },
    "confidence": "high",
    "sources": [
      "SRC_DUNLOSKY_2013",
      "SRC_ROEDIGER_KARPICKE_2006"
    ],
    "limitations": "Effect hangt af van kwaliteit van vragen en spacing; te vroege of te moeilijke items kunnen frustreren.",
    "applicability_notes": "Zet AI in om vragen te genereren en feedback te structureren, niet om antwoorden te geven."
  },
  {
    "claim_id": "CLM_FEEDBACK_SPECIFIC",
    "statement": "Feedback is het meest leerzaam wanneer het specifiek is, gericht op het gat tussen huidig en gewenst niveau, en expliciet maakt wat de volgende stap is.",
    "supports": {
      "rubric_dimensions": [
        "C_CoRegulatie",
        "V_Vaardigheidspotentieel"
      ],
      "design_patterns": [
        "feed_up_back_forward",
        "success_criteria"
      ]
    },
    "confidence": "high",
    "sources": [
      "SRC_HATTIE_TIMPERLEY_2007",
      "SRC_SHUTE_2008"
    ],
    "limitations": "Ongefilterde feedback kan overbelasting of afhankelijkheid veroorzaken, vooral bij beginners.",
    "applicability_notes": "De EAI-card verplicht succescriteria en een feedbackformat met next steps."
  },
  {
    "claim_id": "CLM_COG_LOAD_NOVICE",
    "statement": "Beginners leren beter met expliciete instructie, worked examples en het beperken van extraneous cognitive load. Te open problemen of te veel vrijheid leidt vaak tot slechter leren.",
    "supports": {
      "rubric_dimensions": [
        "K_KennisType",
        "TD_Taakdichtheid",
        "T_TechnologischeIntegratieVisibility"
      ],
      "design_patterns": [
        "worked_examples",
        "guided_practice"
      ]
    },
    "confidence": "high",
    "sources": [
      "SRC_SWELLER_1988",
      "SRC_PAAS_RENKL_SWELLER_2003",
      "SRC_KIRSCHNER_SWELLER_CLARK_2006"
    ],
    "limitations": "Naarmate expertise groeit moet guidance afgebouwd worden om transfer te stimuleren.",
    "applicability_notes": "Logic gates in SSOT begrenzen taakdichtheid bij K1 en K3."
  },
  {
    "claim_id": "CLM_ICAP_CONSTRUCTIVE",
    "statement": "Leeropbrengsten zijn doorgaans hoger wanneer leerlingen actief en constructief handelen (uitleggen, redeneren, vergelijken) dan wanneer zij alleen passief consumeren.",
    "supports": {
      "rubric_dimensions": [
        "V_Vaardigheidspotentieel",
        "S_SocialeInteractie",
        "L_LeercontinuiteitTransfer"
      ],
      "design_patterns": [
        "explain_your_reasoning",
        "compare_and_justify"
      ]
    },
    "confidence": "medium",
    "sources": [
      "SRC_CHI_WYLIE_2014"
    ],
    "limitations": "Effect verschilt per taak en domein; goede scaffolding blijft nodig.",
    "applicability_notes": "De card vraagt altijd om leerling-output met redenering, niet alleen eindantwoord."
  },
  {
    "claim_id": "CLM_SRL_PROMPTS",
    "statement": "Zelfregulatie verbetert wanneer leerlingen expliciet worden geholpen met plannen, monitoren en evalueren, bijvoorbeeld via vragen die metacognitieve checks uitlokken.",
    "supports": {
      "rubric_dimensions": [
        "C_CoRegulatie",
        "L_LeercontinuiteitTransfer"
      ],
      "design_patterns": [
        "plan_monitor_evaluate",
        "metacognitive_prompts"
      ]
    },
    "confidence": "medium",
    "sources": [
      "SRC_ZIMMERMAN_2002",
      "SRC_BUTLER_WINNE_1995"
    ],
    "limitations": "Te veel prompts kan de taak verstoren; timing en dosering zijn cruciaal.",
    "applicability_notes": "Bij K3 is AI beperkt tot vragen en reflectie, zonder oplossingen."
  },
  {
    "claim_id": "CLM_GAI_RISK_VERIFY",
    "statement": "Generatieve AI kan overtuigende, maar onjuiste output produceren. Voor onderwijscontexten met bewijswaarde of hoge stakes zijn verificatie, transparantie en logging essentieel.",
    "supports": {
      "rubric_dimensions": [
        "E_EpistemischeBetrouwbaarheid",
        "T_TechnologischeIntegratieVisibility",
        "B_BiasCorrectie"
      ],
      "design_patterns": [
        "verification_checklist",
        "source_trace"
      ]
    },
    "confidence": "high",
    "sources": [
      "SRC_NIST_AIRMF_2023",
      "SRC_UNESCO_2023"
    ],
    "limitations": "Policy documents zijn geen effectstudies; ze beschrijven risicoâ€™s en aanbevelingen.",
    "applicability_notes": "De card bevat verplichte checks en een output contract dat proces zichtbaar maakt."
  },
  {
    "claim_id": "CLM_SPACING",
    "statement": "Gespreid oefenen (spacing) levert gemiddeld betere langetermijnretentie op dan massed practice. Spacing werkt vooral goed wanneer herhaling wordt gepland met voldoende tijd tussen oefenmomenten.",
    "supports": {
      "rubric_dimensions": [
        "P_Procesfase",
        "L_LeercontinuiteitTransfer"
      ],
      "design_patterns": [
        "spaced_practice",
        "practice_schedule"
      ]
    },
    "confidence": "high",
    "sources": [
      "SRC_CEPEDA_2006"
    ],
    "limitations": "Optimale spacing hangt af van het tijdsinterval tot de toets of toepassing.",
    "applicability_notes": "De EAI-card kan een oefenplan genereren, maar de leerling moet de oefeningen zelf uitvoeren."
  }
]